Sampled Row ID,Resume_Id,Resume_Dec,cluster,Job_Id,Job_desc
2632,391,"I'm an independent consultant available to develop Jasper Reports for your business on an as-needed basis. My experience includes 20+ years as a Java Developer along with 12 years of Jasper Reports and Jasper Server. I've developed reports for the auto loan industry, time and attendance reports for various agencies, and generated permits and related documents for an application servicing municipal and county governments nationwide. I will do the work remotely, but open to travel one-time if necessary. Please contact me with your reporting requirements.    ",6,454,"¡CÓMO CONTRATAR CONDUCTORES PORTUARIOS! ¡NO SE NECESITA EXPERIENCIA! (SEATTLE/TACOME) <image 1 of 1>1451 Thorne Rd            (google map)        compensation: $27.00 + OVERTIMEemployment type: full-timeQR Code Link to This Post¡RoadOne IntermodaLogistics AHORA está contratando conductores de la empresa para nuestra terminal de Seattle! Los conductores de RoadOne transportarán contenedores dentro y fuera del puerto SeaTac. ¡Haga clic en el enlace a continuación para comenzar hoy mismo su gratificante carrera!https://intelliapp.driverapponline.com/c/roadone?r=craigslist_benjaminBeneficios:- $ 27 por hora-Último equipo (automáticas)-Pago por tiempo extra-401k plan-Beneficios médicos (después de 30 días)-un promedio de 50 horas a la semana-PTO pagadoRequisitos:-23 años-1 año de experiencia T / T verificable-Tarjeta TWIC-dot médico actual-debe poder PASAR una prueba de detección de drogas DOT-No DUI o DWI (tras revisión)-No delitos graves (últimos 7 años)Llame a Ben al 909.342.7552 ext. 2110 o celular al 909.248.5013RoadOne IntermodaLogistics es la principal empresa de transporte intermodal de servicio completo y logística relacionada de Norteamérica. Al ofrecer la más alta calidad, transporte de contenedores por ferrocarril y puerto líder en la industria, operaciones de terminal, servicios de carga de camiones dedicados y soluciones de transbordo, almacenamiento y distribución en todo el país, estamos listos para cumplir con los requisitos de transporte que necesita en los Estados Unidos y Canadá.Solo los directores. Reclutadores, no se comuniquen con este cartel de trabajo.    Principals only. Recruiters, please don't contact this job poster.do NOT contact us with unsolicited services or offerspost id: 7416030871posted: 2021-12-03 1"
3032,432,"I am 68 years old. 13 years experience. I have experience with patients who have Alzheimer's/ Dementia, post surgery, diabetes, hospice. I can take vitals, blood sugars, insulin, baths/ showers, dressings. I can cook, clean, or simply be a companion for your loved one during the day. I can provide references. If you are interested meeting me please send an e-mail. I look forward to hearing from you and have a blessed day☺If interested provide detale information about patient and his needs, location and salary you offer per day.Available in all Chicagoland: Chicago, IL, Norridge, Park Ridge, Niles, Des Plaines, Morton Grove, Elmwood Park, River Grove, Schiller Park, Harwood heights, Mount Prospect, Prospect Heights, Bensenville, Elmhurst, Franklin Park, Arlington Heights, Glenview, Glencoe, Wheeling, Northbrook.    ",6,61,"Lyft Driver - Earn up to $31.00/hr in Seattle (Seattle)             (google map)        compensation: $31.00employment type: full-timeQR Code Link to This Post This opportunity is for an independent contractor. Driving with Lyft is perfect for a those looking for entry level work, seasonal work, temporary work, part time work or for those looking for a flexible full time opportunity. Be your own boss, hours are completely flexible. Drive when you want, Drive more to earn more. Drive parttime or fulltime-it is your choice! You can also cash out instantly. No previous experience as a transportation driver, truck driver, taxi driver, shuttle driver, courier driver or delivery driver is necessary. We welcome those who have driven with other peer-to-peer ridesharing networks or on-demand jobs, gigs, opportunities such as Uber, Uber X, Uber Eats, Uber Pool, Uber XL, Uber Black, or other services like Amazon, Amazon Fresh, Amazon Flex, Caviar, Door Dash, Eat24, Favor, Google Express, GrubHub, Handy, Instacart, Luxe, Munchery, OrderAhead, Peach, Postmates, Seamless, Sprig, Shyp, Washio, Wingz, Gett, Juno, Flywheel, DoorDash. Our drivers come from all backgrounds, industries, job, gig, internship types ranging from driving to retail, customer service, creative industries and general labor. If you are an actor, actress, admin, agency, artist, assistant, barista, bartender, broker, cab driver, cashier, chauffeur, cleaner, college student, customer service agent, chef, contract worker, cook, designer, dishwasher, dog walker, entrepreneurs, fitness trainer, food prep, food services, freelancer, handyman, hostess, insurance broker, instructor, intern, janitor, maid, maintenance, messenger, manager, management, musician, maid, office assistant, office administrator, photographer, private hire, professional driver, realtor, retail associate, sales associate, sales person, security, server, students, teacher, tutor, valet, veteran, waiter, waitress who is looking for a flexible part-time, full-time or summer gig, apply to drive with Lyft to supplement your income this summer! Esta oportunidad es para un contratista independiente. La conduccion con Lyft es perfecta para aquellos buscando el trabajo de nivel de entrada, el trabajo estacional, el trabajo temporal, el trabajo de tiempo parcial o para aquellos buscando una oportunidad a tiempo completo flexible. Este su propio jefe, las horas son completamente flexibles. Trabajo cuando usted quiere, Conduce mas para ganar mas. Usted tambien puede cobrar en efectivo al instante. No se requiere experiencia. Nuestros choferes vienen de industrias de conduccion y transporte a servicio de cliente, industrias creativas y trabajo general. Si usted es un actor, la actriz, el artista, el ayudante, barista, el camarero, el agente de bolsa, el conductor del taxi, el chofer, el encargado de limpieza, el estudiante de colegio, el agente de servicio de cliente, contrate a trabajador, disenador, persiga a paseante, empresarios, entrenador de buena forma fisica, servicios de alimento, trabajador independiente, manitas, anfitriona, corredor de seguros, instructor, interno, portero, criada, mantenimiento, mensajero, musico, criada, chofer de alquiler privado, agente inmobiliario, socio de venta al publico, socio de ventas, persona de ventas, seguridad, servidor, estudiantes, profesor, tutor, mozo de camara, veterano, camarero, camarera aplicar y conducir con Lyft para complementar tus ingresos!Apply to Drive Principals only. Recruiters, please don't contact this job poster.do NOT contact us with unsolicited services or offerspost id: 7416316522posted: 2021-12-04 0"
410,64,"Hey there,I am looking for regular long term part or full time work remotely in website development.HTML, CSS, Wordpress, WooCommerce/Shopify (E-Commerce), Basic Graphic Design, General SEO, Domain/Hosting/CPanel, Website Maintenance/Speed Optimizations, App Development Builders.No phone calls pls. Send a message to get in touch :)Thank you    ",6,31,"✨NEED HOUSE CLEANERS TO START THIS WEEK ✨$27+/hr, Paid Weekly             (google map)        compensation: up to $1500 per weekemployment type: contractrelocation assistance availableQR Code Link to This PostCLICK HERE TO APPLY IN 60 SECONDSHi, we're a local housecleaning company and we are getting a rush of clients and need cleaners to start now!If you have cleaning experience, we'd love to work with you. Typical starting schedule consists of 10-20 hrs/week, but can quickly turn into a 40hrs/week.WHY YOU SHOULD APPLY1. Competitive pay ($27+/hr)2. Flexible hours (you set your own schedule!)3. Professional cleaning certification includedAnd more...We will get back to you quickly.  We are hiring aggressively right NOW!Requirements:1. Must have a valid social security number and authorized to work in the United States. (we conduct background checks prior to your start)2. Must have housecleaning experienceAPPLY ONLINE BELOWThanks, we will respond quickly!APPLY ONLINE in 60 SECONDSKeywords: cleaning, housekeeper, house keeper, housekeeping, house keeping, housecleaner, house cleaner, housecleaning, house cleaning, cleaner, maid, limpieza de casas, limpieza, ama de casa, servicio de limpieza, Queen Anne, Downtown, Belltown, Downtown, Belltown, Lower Queen Anne, Queen Anne, Ballard, Magnolia, Capitol Hill, Beacon Hill, Crown Hill, Columbia City, Central District, Rainier Beach, Renton, Tukwila, Mill Creek, SODO, Ravenna, Madrona, Seaview, Delridge, Laurelhurst, West Seattle, Washington Park, Madison Park, Montlake, U District, Fairmount Park, White Center, Redmond, Kirkland, West Lake Hills, SeaTac, Kent, Mercer Island, Wallingford, Phinney Ridge, Lynnwood, Mountlake Terrace, Mukilteo, Fremont, Northgate, Homejoy, Molly Maids, clean, cleaner, cleaners, cleaning, house keeping, house keeper, house keepers, housekeeper, housekeeping, housekeepers, maid, janitor, maids, job, jobs, limpieza, limpiador, homejoy, limpiar, mucama, camarera, parttime, handy, handybook, handy book, homejoy cleaner, part time, part-time, full time, full-time, homejoy job, contract, gig, skill, trade, hotel, hospitality, flexible job, part-time job, part-time jobs, contractor, home joy, contracter, cleaning job, housekeeping job, house keeping job, home cleaner, handybook, handy book, handybook cleaner, handy book cleaner, handybook job, handy book job, student job, student jobs, seasonal worker, seasonal job, intern, merrymaids, merry maids, molly maids, mollymaids, getmaids, local cleaning, dusting, house keeping job, housekeeping job, commercial, janitor, cleaning team.  clean, cleaner, cleaners, cleaning, house keeping, house keeper, house keepers, housekeeper, housekeeping, housekeepers, maid, janitor, maids, limpieza, limpiador, limpiar, mucama, handy, hotel, cleaning job, housekeeping job, house keeping job, home cleaner, merrymaids, merry maids, molly maids, mollymaids, getmaids, local cleaning, dusting, house keeping job, housekeeping job, commercial, janitor, cleaning team, cleaning, cleaning jobs, cleaner, cleaner jobs, housekeeping, house keeping, housekeeper, housekeepers, house keeper jobs, home cleaner, cleaning houses, maid, maid services, domestic cleaners, domestic help, home services, house cleaner jobs, custodian, custodial, maintenance, professional cleaner, limpieza residencial, mantenimiento de la casa, ama de casa, amas de llaves, trabajos encargado de casa, limpiador de casa, limpiando casas, criada, servicios de limpieza, a tiempo parcial, trabajo a tiempo parcial, el empleo a tiempo parcial, housekeeper job, cleaning jobs, housekeeping jobs, cleaning jobs near me, housekeeping jobs near me, house cleaning jobs, office cleaning jobs, housekeeper jobs, janitorial jobs, house cleaning jobs near me, looking for cleaning job, part time cleaning jobs, cleaning, services jobs, hotel housekeeping jobs, local cleaning jobs, night cleaning jobs, maid jobs, office cleaning jobs near me, private cleaning jobs, commercial cleaning jobs, janitorial jobs near me, private house cleaning jobs, domestic cleaning jobs, cleaning vacancies, cleaning jobs hiring, cleaners wanted, cleaning companies hiring near me, cleaning company jobs, part time cleaning jobs near me, cleaning jobs hiring near me, house cleaning wanted, cleaning services hiring near me, hotel cleaning jobs, find cleaning jobs, cleaning job available, private housekeeper jobs, full time cleaning jobs, home cleaning jobs, housekeeping jobs hiring, housekeeping jobs hiring near me, cleaning agency jobs, empleos de limpieza, trabajos de limpieza, trabajos de limpieza de la casa, trabajos de limpieza, trabajos de limpieza de hotel, trabajos de limpieza locales, trabajos de limpieza nocturna, trabajos de limpieza, trabajos de limpieza de oficinas cerca de, trabajos de limpieza privados, trabajos de limpieza comercial, trabajos de limpieza de casas privadas, limpieza de puestos de trabajo, limpiadores queridos, trabajos de limpieza, trabajos de limpieza a tiempo parcial, limpieza de casas querida, trabajos de limpieza de hoteles, encontrar trabajos de limpieza, trabajos de limpieza disponibles, privados trabajos de ama de llaves, trabajos de limpieza a tiempo completo, trabajos de limpieza del hogar.Please remember that NW Maids is the creator of a technology platform that connects clients with qualified independent professionals in the business of providing home cleaning.  NW Maids does not provide those services and does not employ individuals to perform such services. NW Maids' role is limited to offering the technology platform as a referral tool for clients and qualified independent professionals Principals only. Recruiters, please don't contact this job poster.do NOT contact us with unsolicited services or offerspost id: 7416381289posted: 2021-12-04 0"
74,13,"Hello,I have over 20 years virtual administrative experience and am looking to assist a small business owner as needed part time from my home in Santa Cruz. I have experience as an operations leader for a travel company, events coordinator for a cyber security company, various positions as executive assistant and have developed a community program with volunteers. Through the years I have gained exceptional organizational and project management skills, and am familiar with various platforms of operation.Due to C-List spam, please include a description of what you are needing help with. A link to your website would also be helpful. I will be happy to send you a resume.I look forward to speaking with you!    ",6,61,"Lyft Driver - Earn up to $31.00/hr in Seattle (Seattle)             (google map)        compensation: $31.00employment type: full-timeQR Code Link to This Post This opportunity is for an independent contractor. Driving with Lyft is perfect for a those looking for entry level work, seasonal work, temporary work, part time work or for those looking for a flexible full time opportunity. Be your own boss, hours are completely flexible. Drive when you want, Drive more to earn more. Drive parttime or fulltime-it is your choice! You can also cash out instantly. No previous experience as a transportation driver, truck driver, taxi driver, shuttle driver, courier driver or delivery driver is necessary. We welcome those who have driven with other peer-to-peer ridesharing networks or on-demand jobs, gigs, opportunities such as Uber, Uber X, Uber Eats, Uber Pool, Uber XL, Uber Black, or other services like Amazon, Amazon Fresh, Amazon Flex, Caviar, Door Dash, Eat24, Favor, Google Express, GrubHub, Handy, Instacart, Luxe, Munchery, OrderAhead, Peach, Postmates, Seamless, Sprig, Shyp, Washio, Wingz, Gett, Juno, Flywheel, DoorDash. Our drivers come from all backgrounds, industries, job, gig, internship types ranging from driving to retail, customer service, creative industries and general labor. If you are an actor, actress, admin, agency, artist, assistant, barista, bartender, broker, cab driver, cashier, chauffeur, cleaner, college student, customer service agent, chef, contract worker, cook, designer, dishwasher, dog walker, entrepreneurs, fitness trainer, food prep, food services, freelancer, handyman, hostess, insurance broker, instructor, intern, janitor, maid, maintenance, messenger, manager, management, musician, maid, office assistant, office administrator, photographer, private hire, professional driver, realtor, retail associate, sales associate, sales person, security, server, students, teacher, tutor, valet, veteran, waiter, waitress who is looking for a flexible part-time, full-time or summer gig, apply to drive with Lyft to supplement your income this summer! Esta oportunidad es para un contratista independiente. La conduccion con Lyft es perfecta para aquellos buscando el trabajo de nivel de entrada, el trabajo estacional, el trabajo temporal, el trabajo de tiempo parcial o para aquellos buscando una oportunidad a tiempo completo flexible. Este su propio jefe, las horas son completamente flexibles. Trabajo cuando usted quiere, Conduce mas para ganar mas. Usted tambien puede cobrar en efectivo al instante. No se requiere experiencia. Nuestros choferes vienen de industrias de conduccion y transporte a servicio de cliente, industrias creativas y trabajo general. Si usted es un actor, la actriz, el artista, el ayudante, barista, el camarero, el agente de bolsa, el conductor del taxi, el chofer, el encargado de limpieza, el estudiante de colegio, el agente de servicio de cliente, contrate a trabajador, disenador, persiga a paseante, empresarios, entrenador de buena forma fisica, servicios de alimento, trabajador independiente, manitas, anfitriona, corredor de seguros, instructor, interno, portero, criada, mantenimiento, mensajero, musico, criada, chofer de alquiler privado, agente inmobiliario, socio de venta al publico, socio de ventas, persona de ventas, seguridad, servidor, estudiantes, profesor, tutor, mozo de camara, veterano, camarero, camarera aplicar y conducir con Lyft para complementar tus ingresos!Apply to Drive Principals only. Recruiters, please don't contact this job poster.do NOT contact us with unsolicited services or offerspost id: 7416316522posted: 2021-12-04 0"
2861,414,"Seeking to service one individual or family as a private driver.I will drive my vehicle or yours and service the entire Chicago and suburban area.Honest--Trustworthy--PRIVATE--Punctual--Educated--SAFECCL$100,000 per year minimum salary for 10 hours a day six days (of your choosing/flexible) a weekFormer professional educator (22 years) with impeccable referencesLoyalty is my forte--Privacy is my creedFor the protection of you and your loved ones my loyalty is assuredEmail me to schedule a private personal meeting.Please--serious inquires only",6,60,"Lyft Driver - Earn up to $31.00/hr in Tacoma (Tacoma)             (google map)        compensation: $31.00employment type: full-timeQR Code Link to This Post This opportunity is for an independent contractor. Driving with Lyft is perfect for a those looking for entry level work, seasonal work, temporary work, part time work or for those looking for a flexible full time opportunity. Be your own boss, hours are completely flexible. Drive when you want, Drive more to earn more. Drive parttime or fulltime-it is your choice! You can also cash out instantly. No previous experience as a transportation driver, truck driver, taxi driver, shuttle driver, courier driver or delivery driver is necessary. We welcome those who have driven with other peer-to-peer ridesharing networks or on-demand jobs, gigs, opportunities such as Uber, Uber X, Uber Eats, Uber Pool, Uber XL, Uber Black, or other services like Amazon, Amazon Fresh, Amazon Flex, Caviar, Door Dash, Eat24, Favor, Google Express, GrubHub, Handy, Instacart, Luxe, Munchery, OrderAhead, Peach, Postmates, Seamless, Sprig, Shyp, Washio, Wingz, Gett, Juno, Flywheel, DoorDash. Our drivers come from all backgrounds, industries, job, gig, internship types ranging from driving to retail, customer service, creative industries and general labor. If you are an actor, actress, admin, agency, artist, assistant, barista, bartender, broker, cab driver, cashier, chauffeur, cleaner, college student, customer service agent, chef, contract worker, cook, designer, dishwasher, dog walker, entrepreneurs, fitness trainer, food prep, food services, freelancer, handyman, hostess, insurance broker, instructor, intern, janitor, maid, maintenance, messenger, manager, management, musician, maid, office assistant, office administrator, photographer, private hire, professional driver, realtor, retail associate, sales associate, sales person, security, server, students, teacher, tutor, valet, veteran, waiter, waitress who is looking for a flexible part-time, full-time or summer gig, apply to drive with Lyft to supplement your income this summer! Esta oportunidad es para un contratista independiente. La conduccion con Lyft es perfecta para aquellos buscando el trabajo de nivel de entrada, el trabajo estacional, el trabajo temporal, el trabajo de tiempo parcial o para aquellos buscando una oportunidad a tiempo completo flexible. Este su propio jefe, las horas son completamente flexibles. Trabajo cuando usted quiere, Conduce mas para ganar mas. Usted tambien puede cobrar en efectivo al instante. No se requiere experiencia. Nuestros choferes vienen de industrias de conduccion y transporte a servicio de cliente, industrias creativas y trabajo general. Si usted es un actor, la actriz, el artista, el ayudante, barista, el camarero, el agente de bolsa, el conductor del taxi, el chofer, el encargado de limpieza, el estudiante de colegio, el agente de servicio de cliente, contrate a trabajador, disenador, persiga a paseante, empresarios, entrenador de buena forma fisica, servicios de alimento, trabajador independiente, manitas, anfitriona, corredor de seguros, instructor, interno, portero, criada, mantenimiento, mensajero, musico, criada, chofer de alquiler privado, agente inmobiliario, socio de venta al publico, socio de ventas, persona de ventas, seguridad, servidor, estudiantes, profesor, tutor, mozo de camara, veterano, camarero, camarera aplicar y conducir con Lyft para complementar tus ingresos!Apply to Drive Principals only. Recruiters, please don't contact this job poster.do NOT contact us with unsolicited services or offerspost id: 7416316620posted: 2021-12-04 0"
4329,600,"Available to work as private caregiver/companion any where in Des Plaines IL area or nearest Suburbs.available (7am- 8pm)  3-5 days a week $25 per hour.Full -Time or Part-Time employment. 16 years experience,       "" Serious Offers Only ""Keywords:  caregiver‎, senior care assistance, elderly care, Available now ",6,244,"✭✭Lyft Driver in Seattle- Earn up to $31.00/hr✭✭ (Seattle)             (google map)        compensation: $31.00employment type: full-timeQR Code Link to This Post This opportunity is for an independent contractor. Driving with Lyft is perfect for a those looking for entry level work, seasonal work, temporary work, part time work or for those looking for a flexible full time opportunity. Be your own boss, hours are completely flexible. Drive when you want, Drive more to earn more. Drive parttime or fulltime-it is your choice! You can also cash out instantly. No previous experience as a transportation driver, truck driver, taxi driver, shuttle driver, courier driver or delivery driver is necessary. We welcome those who have driven with other peer-to-peer ridesharing networks or on-demand jobs, gigs, opportunities such as Uber, Uber X, Uber Eats, Uber Pool, Uber XL, Uber Black, or other services like Amazon, Amazon Fresh, Amazon Flex, Caviar, Door Dash, Eat24, Favor, Google Express, GrubHub, Handy, Instacart, Luxe, Munchery, OrderAhead, Peach, Postmates, Seamless, Sprig, Shyp, Washio, Wingz, Gett, Juno, Flywheel, DoorDash. Our drivers come from all backgrounds, industries, job, gig, internship types ranging from driving to retail, customer service, creative industries and general labor. If you are an actor, actress, admin, agency, artist, assistant, barista, bartender, broker, cab driver, cashier, chauffeur, cleaner, college student, customer service agent, chef, contract worker, cook, designer, dishwasher, dog walker, entrepreneurs, fitness trainer, food prep, food services, freelancer, handyman, hostess, insurance broker, instructor, intern, janitor, maid, maintenance, messenger, manager, management, musician, maid, office assistant, office administrator, photographer, private hire, professional driver, realtor, retail associate, sales associate, sales person, security, server, students, teacher, tutor, valet, veteran, waiter, waitress who is looking for a flexible part-time, full-time or summer gig, apply to drive with Lyft to supplement your income this summer! Esta oportunidad es para un contratista independiente. La conduccion con Lyft es perfecta para aquellos buscando el trabajo de nivel de entrada, el trabajo estacional, el trabajo temporal, el trabajo de tiempo parcial o para aquellos buscando una oportunidad a tiempo completo flexible. Este su propio jefe, las horas son completamente flexibles. Trabajo cuando usted quiere, Conduce mas para ganar mas. Usted tambien puede cobrar en efectivo al instante. No se requiere experiencia. Nuestros choferes vienen de industrias de conduccion y transporte a servicio de cliente, industrias creativas y trabajo general. Si usted es un actor, la actriz, el artista, el ayudante, barista, el camarero, el agente de bolsa, el conductor del taxi, el chofer, el encargado de limpieza, el estudiante de colegio, el agente de servicio de cliente, contrate a trabajador, disenador, persiga a paseante, empresarios, entrenador de buena forma fisica, servicios de alimento, trabajador independiente, manitas, anfitriona, corredor de seguros, instructor, interno, portero, criada, mantenimiento, mensajero, musico, criada, chofer de alquiler privado, agente inmobiliario, socio de venta al publico, socio de ventas, persona de ventas, seguridad, servidor, estudiantes, profesor, tutor, mozo de camara, veterano, camarero, camarera aplicar y conducir con Lyft para complementar tus ingresos!Apply to Drive Principals only. Recruiters, please don't contact this job poster.do NOT contact us with unsolicited services or offerspost id: 7416118184posted: 2021-12-03 1"
