Sampled Row ID,Resume_Id,Resume_Dec,cluster,Job_Id,Job_desc
5169,655,"I'm looking for job from home ASAP.Good pay a must!Legal,moral and ethical.No post adds on Craiglist notransfer money or funds.In your e-mail include jobdescription,pay and your address.    ",0,67,"Real Estate Broker - Lots of Leads (Lynnwood) <image 1 of 3>compensation: commission basisemployment type: full-timeQR Code Link to This PostWe are two real estate attorneys who are also licensed brokers, supported by my wife. We work as a team from our home office in Lynnwood. We work with Keller Williams in Everett.We are looking for a smart real estate broker who needs good leads. We have far more leads than we can handle. We use Brivity, and it would be helpful if you have experience with Brivity or a similar CRM. If you don't, you can learn it. We will work the database together. We advertise commercial properties on Loopnet and Chrexi, and the many leads need to be contacted. Our Google Business ads attract calls almost daily. These are people who typically own real estate or want to buy or sell real estate. So we have hundreds of former clients that we need to stay in contact with.So your job would be to work the database, using Brivity to send emails, text messages, and market reports.  You will get a percentage on every file you add value to, whether you work the file or turn it over to other team members.We give most legal advice to our buyers and sellers for no extra charge. The fact that we can provide legal assistance will give you credibility and help you win sellers and buyers that you might not otherwise win. My wife is an FHA reverse mortgage specialist. Someone who is 62 or older can pay half down and buy property with a reverse mortgage to cover the other half, and never have to make a monthly payment. This is a valuable purchasing tool.We want someone who is honest, relaxed, easy going, polite, and considerate - but committed. Please send a letter or resume. If you reply I will keep your application confidential.  I will reply to everyone who inquires or applies.We also co-broker with other brokers on seller financed, commercial, and legally challenging deals. We generally take payment at closing with no payment up front, generally in the form of commissions but sometimes as attorney fees. James Robert Dealwww.WashingtonAttorneyBroker.comwww.ReverseMortgageAttorney.us425-774-6611    Principals only. Recruiters, please don't contact this job poster.do NOT contact us with unsolicited services or offersOK to highlight this job opening for persons with disabilitiespost id: 7416295757posted: 2021-12-04 0"
4913,29,Im a driver looking for work. I have my Liscense to drive from wa. And ill have my class A-CDL after the new yr. *(please dont offer me a job after i did the hard work of paying my own way to cdl.)*However in the interest of fairness if you wish to pay for it even in part im willing to sign on with your company only after i have it. What im willing to sign is a non compete clause for employment in regards to driving cdl vehicles FOR ANY1 but u.Duration of this non compete is based on how much of my class is paid for up to years 3-6 yrs. Details can be hashed out upon meeting.Until then i only have my my personal License and insurance to drive. Im always on time and honest to a fault txt me any time and even if i dont answer shoot me a txt instead of voice mail.253883 83$ix8Ask for mario    ,0,67,"Real Estate Broker - Lots of Leads (Lynnwood) <image 1 of 3>compensation: commission basisemployment type: full-timeQR Code Link to This PostWe are two real estate attorneys who are also licensed brokers, supported by my wife. We work as a team from our home office in Lynnwood. We work with Keller Williams in Everett.We are looking for a smart real estate broker who needs good leads. We have far more leads than we can handle. We use Brivity, and it would be helpful if you have experience with Brivity or a similar CRM. If you don't, you can learn it. We will work the database together. We advertise commercial properties on Loopnet and Chrexi, and the many leads need to be contacted. Our Google Business ads attract calls almost daily. These are people who typically own real estate or want to buy or sell real estate. So we have hundreds of former clients that we need to stay in contact with.So your job would be to work the database, using Brivity to send emails, text messages, and market reports.  You will get a percentage on every file you add value to, whether you work the file or turn it over to other team members.We give most legal advice to our buyers and sellers for no extra charge. The fact that we can provide legal assistance will give you credibility and help you win sellers and buyers that you might not otherwise win. My wife is an FHA reverse mortgage specialist. Someone who is 62 or older can pay half down and buy property with a reverse mortgage to cover the other half, and never have to make a monthly payment. This is a valuable purchasing tool.We want someone who is honest, relaxed, easy going, polite, and considerate - but committed. Please send a letter or resume. If you reply I will keep your application confidential.  I will reply to everyone who inquires or applies.We also co-broker with other brokers on seller financed, commercial, and legally challenging deals. We generally take payment at closing with no payment up front, generally in the form of commissions but sometimes as attorney fees. James Robert Dealwww.WashingtonAttorneyBroker.comwww.ReverseMortgageAttorney.us425-774-6611    Principals only. Recruiters, please don't contact this job poster.do NOT contact us with unsolicited services or offersOK to highlight this job opening for persons with disabilitiespost id: 7416295757posted: 2021-12-04 0"
4986,210,"Hello, I have a construction background. Currently part of the pipeliners union but, laid off due to it being slow. Seeking a job in the same industry. Willing to travel if pay is right.    ",0,67,"Real Estate Broker - Lots of Leads (Lynnwood) <image 1 of 3>compensation: commission basisemployment type: full-timeQR Code Link to This PostWe are two real estate attorneys who are also licensed brokers, supported by my wife. We work as a team from our home office in Lynnwood. We work with Keller Williams in Everett.We are looking for a smart real estate broker who needs good leads. We have far more leads than we can handle. We use Brivity, and it would be helpful if you have experience with Brivity or a similar CRM. If you don't, you can learn it. We will work the database together. We advertise commercial properties on Loopnet and Chrexi, and the many leads need to be contacted. Our Google Business ads attract calls almost daily. These are people who typically own real estate or want to buy or sell real estate. So we have hundreds of former clients that we need to stay in contact with.So your job would be to work the database, using Brivity to send emails, text messages, and market reports.  You will get a percentage on every file you add value to, whether you work the file or turn it over to other team members.We give most legal advice to our buyers and sellers for no extra charge. The fact that we can provide legal assistance will give you credibility and help you win sellers and buyers that you might not otherwise win. My wife is an FHA reverse mortgage specialist. Someone who is 62 or older can pay half down and buy property with a reverse mortgage to cover the other half, and never have to make a monthly payment. This is a valuable purchasing tool.We want someone who is honest, relaxed, easy going, polite, and considerate - but committed. Please send a letter or resume. If you reply I will keep your application confidential.  I will reply to everyone who inquires or applies.We also co-broker with other brokers on seller financed, commercial, and legally challenging deals. We generally take payment at closing with no payment up front, generally in the form of commissions but sometimes as attorney fees. James Robert Dealwww.WashingtonAttorneyBroker.comwww.ReverseMortgageAttorney.us425-774-6611    Principals only. Recruiters, please don't contact this job poster.do NOT contact us with unsolicited services or offersOK to highlight this job opening for persons with disabilitiespost id: 7416295757posted: 2021-12-04 0"
5050,355,"My name is Craig and run an all phase company that does all type of work, oddjobs etc. From foundation work to the roof and everything in between. Any small jobs to large jobs or just needing help to complete a job. 24 hour emergency service also so if interested just contact us.    ",0,67,"Real Estate Broker - Lots of Leads (Lynnwood) <image 1 of 3>compensation: commission basisemployment type: full-timeQR Code Link to This PostWe are two real estate attorneys who are also licensed brokers, supported by my wife. We work as a team from our home office in Lynnwood. We work with Keller Williams in Everett.We are looking for a smart real estate broker who needs good leads. We have far more leads than we can handle. We use Brivity, and it would be helpful if you have experience with Brivity or a similar CRM. If you don't, you can learn it. We will work the database together. We advertise commercial properties on Loopnet and Chrexi, and the many leads need to be contacted. Our Google Business ads attract calls almost daily. These are people who typically own real estate or want to buy or sell real estate. So we have hundreds of former clients that we need to stay in contact with.So your job would be to work the database, using Brivity to send emails, text messages, and market reports.  You will get a percentage on every file you add value to, whether you work the file or turn it over to other team members.We give most legal advice to our buyers and sellers for no extra charge. The fact that we can provide legal assistance will give you credibility and help you win sellers and buyers that you might not otherwise win. My wife is an FHA reverse mortgage specialist. Someone who is 62 or older can pay half down and buy property with a reverse mortgage to cover the other half, and never have to make a monthly payment. This is a valuable purchasing tool.We want someone who is honest, relaxed, easy going, polite, and considerate - but committed. Please send a letter or resume. If you reply I will keep your application confidential.  I will reply to everyone who inquires or applies.We also co-broker with other brokers on seller financed, commercial, and legally challenging deals. We generally take payment at closing with no payment up front, generally in the form of commissions but sometimes as attorney fees. James Robert Dealwww.WashingtonAttorneyBroker.comwww.ReverseMortgageAttorney.us425-774-6611    Principals only. Recruiters, please don't contact this job poster.do NOT contact us with unsolicited services or offersOK to highlight this job opening for persons with disabilitiespost id: 7416295757posted: 2021-12-04 0"
4957,147,"Hello! My name is Brandon and I am wanting a job. I have a 100-ton captain license (and a 2nd mate unlimited) and can drive any size vessel. I also have a lot of engineering (mechanical) experience as well. I can fix almost anything, weld, do most construction jobs and most hard labor tasks too. I would prefer not to drive much as that's the one thing I despise! I am educated (UW-History), but that doesn't help employment much. Please reply with any offers you may have out there!    ",0,67,"Real Estate Broker - Lots of Leads (Lynnwood) <image 1 of 3>compensation: commission basisemployment type: full-timeQR Code Link to This PostWe are two real estate attorneys who are also licensed brokers, supported by my wife. We work as a team from our home office in Lynnwood. We work with Keller Williams in Everett.We are looking for a smart real estate broker who needs good leads. We have far more leads than we can handle. We use Brivity, and it would be helpful if you have experience with Brivity or a similar CRM. If you don't, you can learn it. We will work the database together. We advertise commercial properties on Loopnet and Chrexi, and the many leads need to be contacted. Our Google Business ads attract calls almost daily. These are people who typically own real estate or want to buy or sell real estate. So we have hundreds of former clients that we need to stay in contact with.So your job would be to work the database, using Brivity to send emails, text messages, and market reports.  You will get a percentage on every file you add value to, whether you work the file or turn it over to other team members.We give most legal advice to our buyers and sellers for no extra charge. The fact that we can provide legal assistance will give you credibility and help you win sellers and buyers that you might not otherwise win. My wife is an FHA reverse mortgage specialist. Someone who is 62 or older can pay half down and buy property with a reverse mortgage to cover the other half, and never have to make a monthly payment. This is a valuable purchasing tool.We want someone who is honest, relaxed, easy going, polite, and considerate - but committed. Please send a letter or resume. If you reply I will keep your application confidential.  I will reply to everyone who inquires or applies.We also co-broker with other brokers on seller financed, commercial, and legally challenging deals. We generally take payment at closing with no payment up front, generally in the form of commissions but sometimes as attorney fees. James Robert Dealwww.WashingtonAttorneyBroker.comwww.ReverseMortgageAttorney.us425-774-6611    Principals only. Recruiters, please don't contact this job poster.do NOT contact us with unsolicited services or offersOK to highlight this job opening for persons with disabilitiespost id: 7416295757posted: 2021-12-04 0"
5747,633,I'm a very experienced business leader what insurance and real estate skills looking for a part time job that pays gifthat pays cash so I can.... Eat... And pay some bills during this odd period of time. I'm very responsible capable and have great driving skills and a perfect driving record I could help any company do anything I'm ready to go. show contact info,3,92,"McMenamins Elks Temple - now hiring Servers! (Tacoma) <image 1 of 4>565 Broadway            (google map)        compensation: Minimum wage plus tips!employment type: employee's choiceQR Code Link to This PostWe are hiring Servers  for McMenamins Elks Temple Pub in Tacoma, WAMcMenamins is a family-owned company in Oregon and Washington serving our own handcrafted beer, wine, cider, spirits and coffee alongside good, honest pub fare. Locations range from neighborhood pubs to historic hotels. We emphasize community, art, history, music, food, drink and fun. McMenamins has seasonal, as well as long-term career opportunities! We value Diversity, Equity and Inclusion and welcome individuals from diverse backgrounds.Benefits We Offer •	Perks and employee discounts: $45 hotel rooms, 40% off bottles of wine, access to concerts, Happy Hour beverage pricing all day, 40% off McMenamins apparel & spa services, shift meal credits and more•	Comprehensive insurance benefits package, including vision, medical, dental, chiro and alternative care to eligible employees •	401(K) plan with employer contribution to eligible employees•	Paid time off•	Neighborhood pubs and hotels with opportunities to work at other locations like our winery or Edgefield concerts•	Belief in a work/life balance•	Be part of a fun team and positive work environment •	Multiple career path opportunities - we have staff who have gone from front desk attendants to sales associates; from server to manager and many other continuing stories within McMenaminsQualified applicants must:•	Have a willingness to learn•	Enjoy working in a busy customer service-oriented environment •	Previous experience is preferred, but we are willing to trainCommunity•	Resurrection of historic buildings and properties in large and small Northwest communities•	Giving back financially to local schools and non-profits near each location•	Helping other local businesses grow with collaborative products•	Our pubs and hotel properties are places for all to gather, relax, converse, and create a strong foundation for the fabric that makes up a neighborhood Apply in person or online at McMenamins!  Masks required. Apply 24/7 here, or stop by to fill out an application on the spot at 565 Broadway and talk to a manager. E.O.E.Principals only. Recruiters, please don't contact this job poster.do NOT contact us with unsolicited services or offerspost id: 7416192807posted: 2021-12-03 1"
5462,360,Young man experienced in carpentry and other fields. My current job will end around the 17th and I'd like to have something lined up.I'm Open to Part time work sooner than the 17th or customer service jobs. Give me a text and let me know the details at  show contact info,3,86,"McMenamins Elks Temple - now hiring P/T Housekeepers (Tacoma) <image 1 of 3>565 Broadway            (google map)        compensation: Competitive pay based on experienceemployment type: part-timeQR Code Link to This PostMcMenamins Elks Temple is now hiring P/T Housekeeping and Laundry AttendantsMcMenamins is a family-owned company in Oregon and Washington serving our own handcrafted beer, wine, cider, spirits and coffee alongside good, honest pub fare. Locations range from neighborhood pubs to historic hotels. We emphasize community, art, history, music, food, drink and fun. McMenamins has seasonal, as well as long-term career opportunities! We value Diversity, Equity and Inclusion and welcome individuals from diverse backgrounds.Benefits We Offer •	Perks and employee discounts: $45 hotel rooms, 40% off bottles of wine, access to concerts, Happy Hour beverage pricing all day, 40% off McMenamins apparel & spa services, shift meal credits and more•	Comprehensive insurance benefits package, including vision, medical, dental, chiro and alternative care to eligible employees •	401(K) plan with employer contribution to eligible employees•	Paid time off•	Neighborhood pubs and hotels with opportunities to work at other locations like our winery or Edgefield concerts•	Belief in a work/life balance•	Be part of a fun team and positive work environment •	Multiple career path opportunities - we have staff who have gone from front desk attendants to sales associates; from server to manager and many other continuing stories within McMenaminsQualified applicants must:•	Have a willingness to learn•	Enjoy working in a busy customer service-oriented environment •	Previous experience is preferred, but we are willing to trainCommunity•	Resurrection of historic buildings and properties in large and small Northwest communities•	Giving back financially to local schools and non-profits near each location•	Helping other local businesses grow with collaborative products•	Our pubs and hotel properties are places for all to gather, relax, converse, and create a strong foundation for the fabric that makes up a neighborhood Apply in person or online at McMenamins!  Masks required. Apply 24/7 here, or stop by to fill out an application on the spot McMenamins Elks Temple at 565 Broadway and talk to a manager. E.O.E.Principals only. Recruiters, please don't contact this job poster.do NOT contact us with unsolicited services or offerspost id: 7416194825posted: 2021-12-03 1"
5505,384,I AM A NATURAL FANCY ATTORNEY!! I MAKE ALL THE MONEY FOR YOU!!NEED A LAWYER? NEED LEGAL INFORMATION? NEED JUSTICE IN AMERICA??I HAVE THE POWER IN LAW AND AMERICA!!! I CAN HELP YOU!!!!FREE EVALUATION TEXT OR FAX TODAY!!!!TEXT  show contact info FAX  show contact info,3,87,"MCMENAMINS ELKS TEMPLE is now hiring DISHWASHERS (Tacoma) <image 1 of 3>565 Broadwaycompensation: Competitive pay BOE, plus tipsemployment type: part-timeQR Code Link to This PostMCMENAMINS ELKS TEMPLE is now hiring DISHWASHERSMcMenamins is family-owned and operated with 50+ locations in Oregon & Washington. We emphasize community, art, history, music, food, drink and fun. McMenamins has seasonal, as well as long-term career opportunities! Benefits We Offer •	Perks and employee discounts from date of hire (such as food credit, merchandise discounts, hotel room discounts)•	Many career path opportunities•	Comprehensive insurance benefits package, including vision, medical, dental, vision, chiro and alternative care to eligible employees •	401K plan after eligibility requirements are met•	Paid time off (PTO)•	Belief in a work/life balance•	Be part of a fun team and positive work environment Qualified applicants must:Have a willingness to learnEnjoy working in a busy customer service-oriented environment Previous experience is preferred, but we are willing to trainCommunity•	Resurrection of historic buildings and properties in large and small Northwest communities•	We value Diversity and welcome individuals from diverse backgrounds•	Giving back financially to local schools and non-profits near each location•	Helping other local businesses grow with collaborative products•	Our pubs and hotel properties are places for all to gather, relax, converse, and create a strong foundation for the fabric that makes up a neighborhood Apply in person or online at McMenamins!  You can apply 24/7 here or we invite you to stop by to fill out an application on the spot at 565 Broadway and talk to a manager. E.O.E.Principals only. Recruiters, please don't contact this job poster.do NOT contact us with unsolicited services or offerspost id: 7416194444posted: 2021-12-03 1"
5809,654,I'm a food delivery driver looking for work I am fast and reliable. I like to work so I'm afraid to do other work .I've been working in the kitchen for over 25 years. I'm just looking for something to do with my unbusy time . I only do cash 💸 so if u need a real good reliable worker and your willing to pay cash please call me at  show contact info my name is Julio rodriguez    ,3,168,"MCMENAMINS ANDERSON SCHOOL hiring LINE COOKS $1000 hiring bonus! (Bothell) <image 1 of 6>18607 Bothell Way NE            (google map)        compensation: $16-$19/hr BOE + plus tipsemployment type: employee's choiceQR Code Link to This PostMCMENAMINS ANDERSON SCHOOL is now hiring LINE COOKS ! **$1000 hiring bonus for line cooks after 90 days of successful employment **MCMENAMINS is now hiring for our beautiful Anderson School location in Bothell, WA. We are a family-owned company in Oregon and Washington serving our own handcrafted beer, wine, cider, spirits and coffee alongside good, honest pub fare. Locations range from neighborhood pubs to historic hotels. We emphasize community, art, history, music, food, drink and fun. McMenamins has seasonal, as well as long-term career opportunities! We value Diversity, Equity and Inclusion and welcome individuals from diverse backgrounds.Benefits we offer:  Perks and employee discounts: $45 hotel rooms, 40% off bottles of wine, access to concerts, Happy Hour beverage pricing all day, 40% off McMenamins apparel & spa services, shift meal credits and more  Comprehensive insurance benefits package, including vision, medical, dental, chiro and alternative care to eligible employees401(K) plan with employer contribution to eligible employees Paid time off Neighborhood pubs and hotels with opportunities to work at other locations like our winery or Edgefield concertsBelief in a work/life balanceBe part of a fun team and positive work environment! Multiple career path opportunities - we have staff who have gone from front desk attendants to sales associates; from server to manager and many other continuing stories within McMenamins Qualified applicants must:Have a willingness to learnEnjoy working in a busy customer service-oriented environment Have a flexible schedule including weekends and holidaysHave previous experience (preferred), but we are willing to train!CommunityResurrection of historic buildings and properties in large and small Northwest communitiesGiving back financially to local schools and non-profits near each locationHelping other local businesses grow with collaborative productsOur Pubs and Properties are places for all to gather, relax, converse, and create a strong foundation for the fabric that makes up a neighborhoodApply in person or online at McMenamins! You can apply online HERE  or stop by the Anderson School to fill out an application on site @ 18607 Bothell Way NE, Bothell and speak to a manager. Masks required.No phone calls to individual locations please! E.O.EPlease note: Relocation is not offered for this position so in order to be considered, you must be located in the United States.    Principals only. Recruiters, please don't contact this job poster.do NOT contact us with unsolicited services or offerspost id: 7416156045posted: 2021-12-03 1"
